Command: tcpdump -i eth0 -n -c 10 -vvv tcp
Output: 
06:45:15.813366 IP (tos 0x12,ECT(0), ttl 64, id 32070, offset 0, flags [DF], proto TCP (6), length 96)
    165.227.43.214.22 > 70.50.27.35.56532: Flags [P.], cksum 0x3361 (incorrect -> 0x792e), seq 2358311790:2358311834, ack 1464462890, win 501, options [nop,nop,TS val 2370291365 ecr 2872589564], length 44
06:45:15.813429 IP (tos 0x12,ECT(0), ttl 64, id 32071, offset 0, flags [DF], proto TCP (6), length 104)
    165.227.43.214.22 > 70.50.27.35.56532: Flags [P.], cksum 0x3369 (incorrect -> 0x7d1f), seq 44:96, ack 1, win 501, options [nop,nop,TS val 2370291365 ecr 2872589564], length 52
06:45:15.813563 IP (tos 0x12,ECT(0), ttl 64, id 32072, offset 0, flags [DF], proto TCP (6), length 224)
    165.227.43.214.22 > 70.50.27.35.56532: Flags [P.], cksum 0x33e1 (incorrect -> 0x4837), seq 96:268, ack 1, win 501, options [nop,nop,TS val 2370291365 ecr 2872589564], length 172
06:45:15.815838 IP (tos 0x0, ttl 54, id 0, offset 0, flags [DF], proto TCP (6), length 52)
    70.50.27.35.56532 > 165.227.43.214.22: Flags [.], cksum 0x5521 (correct), seq 1, ack 0, win 2047, options [nop,nop,TS val 2872589582 ecr 2370291361], length 0
06:45:15.820890 IP (tos 0x0, ttl 54, id 0, offset 0, flags [DF], proto TCP (6), length 52)
    70.50.27.35.56532 > 165.227.43.214.22: Flags [.], cksum 0x5410 (correct), seq 1, ack 268, win 2043, options [nop,nop,TS val 2872589587 ecr 2370291365], length 0
06:45:15.967228 IP (tos 0x0, ttl 43, id 47116, offset 0, flags [DF], proto TCP (6), length 52)
    43.131.235.215.41880 > 165.227.43.214.22: Flags [.], cksum 0x3c14 (correct), seq 932699153, ack 2044642435, win 263, options [nop,nop,TS val 2252632889 ecr 4009980498], length 0
06:45:15.971341 IP (tos 0x0, ttl 43, id 47117, offset 0, flags [DF], proto TCP (6), length 68)
    43.131.235.215.41880 > 165.227.43.214.22: Flags [P.], cksum 0x31d7 (correct), seq 0:16, ack 1, win 263, options [nop,nop,TS val 2252632893 ecr 4009980498], length 16
06:45:16.012864 IP (tos 0x0, ttl 64, id 21363, offset 0, flags [DF], proto TCP (6), length 52)
    165.227.43.214.22 > 43.131.235.215.41880: Flags [.], cksum 0xe93a (incorrect -> 0x3a27), seq 1, ack 16, win 502, options [nop,nop,TS val 4009980732 ecr 2252632893], length 0
06:45:16.201159 IP (tos 0x0, ttl 43, id 47118, offset 0, flags [DF], proto TCP (6), length 104)
    43.131.235.215.41880 > 165.227.43.214.22: Flags [P.], cksum 0x9bd1 (correct), seq 16:68, ack 1, win 263, options [nop,nop,TS val 2252633123 ecr 4009980732], length 52
06:45:16.201218 IP (tos 0x0, ttl 64, id 21364, offset 0, flags [DF], proto TCP (6), length 52)
    165.227.43.214.22 > 43.131.235.215.41880: Flags [.], cksum 0xe93a (incorrect -> 0x3851), seq 1, ack 68, win 502, options [nop,nop,TS val 4009980920 ecr 2252633123], length 0
Details:
Packet 1:
Source host: 165.227.43.214, source port: 22, destination host: 70.50.27.35, destination port: 56532
Packet 2:
source host: 165.227.43.214, source port: 22, destination host: 70.50.27.35, destination port: 56532
Packet 3:
source host: 165.227.43.214, source port: 22, destination host: 70.50.27.35, destination port: 56532
Packet 4:
source host: 70.50.27.35, source port: 56532, destionation host: 165.227.43.214, destination port: 22
Packet 5:
source host: 70.50.27.35, source port: 56532, destination host: 165.227.43.214, destination port: 22
Packet 6:
source host: 43.131.235.215, source port: 41880, destination host: 165.227.43.214, destination port: 22
Packet 7:
source host: 43.131.235.215, source port: 41880, destination host: 165.227.43.214, destination port: 22
Packet 8:
source host: 165.227.43.214, source port: 22, destination host: 43.131.235.215, destination port: 41880
Packet 9:
source host: 43.131.235.215, source port: 41880, destination host: 165.227.43.214, destination port: 22
Packet 10:
source host: 165.227.43.214, source port: 22, destination host: 43.131.235.215, destination port: 41880
