05:41:32.167798 IP bras-base-toroon0268w-grc-64-70-50-27-35.dsl.bell.ca.56562 > lamp-ubuntu-s-1vcpu-1gb-tor1-01.ssh: Flags [.], ack 947184855, win 2699, options [nop,nop,TS val 260321435 ecr 1405213814], length 0
E..4..@.6...F2.#..+........Z8t....
.VQ.....
..0.S..v
05:41:32.168678 IP lamp-ubuntu-s-1vcpu-1gb-tor1-01.ssh > bras-base-toroon0268w-grc-64-70-50-27-35.dsl.bell.ca.56562: Flags [P.], seq 1:109, ack 0, win 501, options [nop,nop,TS val 1405213819 ecr 260321435], length 108
E...ig@.@.....+.F2.#....8t.....Z....3......
S..{..0....7..T.C.	...!.DuK...0@a8r.	....#9..^..c.....i<NE..7.+.Ba......E...0.8.e...w.....	............A......cQ..`.
05:41:32.168804 IP lamp-ubuntu-s-1vcpu-1gb-tor1-01.ssh > bras-base-toroon0268w-grc-64-70-50-27-35.dsl.bell.ca.56562: Flags [P.], seq 109:265, ack 0, win 501, options [nop,nop,TS val 1405213820 ecr 260321435], length 156
E...ih@.@.....+.F2.#....8t.C...Z....3......
S..|..0.d..].RPQ..8.........u.w-...........(.%a.vv.......H.yQ..!.w.hy.7-.nscI(._....P...	.n...I.y.I..#..."!.~...........F.$.T.. k...V.~&._.......J$...S..p.	..\..."x
05:41:32.168854 IP lamp-ubuntu-s-1vcpu-1gb-tor1-01.ssh > bras-base-toroon0268w-grc-64-70-50-27-35.dsl.bell.ca.56562: Flags [P.], seq 265:333, ack 0, win 501, options [nop,nop,TS val 1405213820 ecr 260321435], length 68
E..xii@.@.....+.F2.#....8t.....Z....3y.....
S..|..0...1.i.....-..7san.|K..P..4b5....:.d..s&M....=...	.(.Y...V&.kmZt.+..=
05:41:32.168897 IP lamp-ubuntu-s-1vcpu-1gb-tor1-01.ssh > bras-base-toroon0268w-grc-64-70-50-27-35.dsl.bell.ca.56562: Flags [P.], seq 333:369, ack 0, win 501, options [nop,nop,TS val 1405213820 ecr 260321435], length 36
E..Xij@.@.....+.F2.#....8t.#...Z....3Y.....
S..|..0..?..Y.8A.]..........X3D8FF..V.S.u...
05:41:32.174915 IP bras-base-toroon0268w-grc-64-70-50-27-35.dsl.bell.ca.56562 > lamp-ubuntu-s-1vcpu-1gb-tor1-01.ssh: Flags [.], ack 369, win 2694, options [nop,nop,TS val 260321443 ecr 1405213820], length 0
E..4..@.6...F2.#..+........Z8t.G..
.T......
..0.S..|
05:41:32.348793 IP 221.163.124.200.42478 > lamp-ubuntu-s-1vcpu-1gb-tor1-01.ssh: Flags [P.], seq 3846960205:3846960285, ack 317255631, win 502, options [nop,nop,TS val 3937008989 ecr 3160192800], length 80
E...\0@.2.....|...+......K.M.........E.....
...].\. ...L.....A.F.#Dk.;.......^...R....b.V. X.|.<..?.RZ[.P2...ft.l(:.)..8Z..i..H.MD..
05:41:32.348859 IP lamp-ubuntu-s-1vcpu-1gb-tor1-01.ssh > 221.163.124.200.42478: Flags [.], ack 80, win 503, options [nop,nop,TS val 3160194186 ecr 3937008989], length 0
E..4.?@.@.Q_..+...|..........K......,L.....
.\.....]
05:41:32.350211 IP lamp-ubuntu-s-1vcpu-1gb-tor1-01.ssh > 221.163.124.200.42478: Flags [P.], seq 1:313, ack 80, win 503, options [nop,nop,TS val 3160194187 ecr 3937008989], length 312
E..l.@@.@.P&..+...|..........K......-......
.\.....]...$	....h....ecdsa-sha2-nistp256....nistp256...A..WSjv.......%.Op................C....!.@.......1x.~.2^~T.fU)..?....A.`k...^..Q.v|U...R.[.._..-....6..M^\.^....
.....w....s?.Qy......8...d....ecdsa-sha2-nistp256...I... `..".....pUZ..e..p...........7.r...!..!....Mw8.$k...{..O.E.....5.P&_G.............
...........
05:41:32.583250 IP 221.163.124.200.42478 > lamp-ubuntu-s-1vcpu-1gb-tor1-01.ssh: Flags [.], ack 313, win 537, options [nop,nop,TS val 3937009223 ecr 3160194187], length 0
E..4\1@.2..m..|...+......K..........b......
...G.\..
05:41:33.187331 IP lamp-ubuntu-s-1vcpu-1gb-tor1-01.40842 > 67.207.67.3.domain: 53971+ [1au] PTR? 214.43.227.165.in-addr.arpa. (56)
E..Tx...@.....+.C.C....5.@X..............214.43.227.165.in-addr.arpa.......)........
05:41:33.207645 IP 67.207.67.3.domain > lamp-ubuntu-s-1vcpu-1gb-tor1-01.40842: 53971 NXDomain 0/1/1 (123)
E.......<.v.C.C...+..5....<..............214.43.227.165.in-addr.arpa................7.ns1.digitalocean.com.
hostmaster..e.*...*0.....	:.......)........
05:41:33.207817 IP lamp-ubuntu-s-1vcpu-1gb-tor1-01.40842 > 67.207.67.3.domain: 53971+ PTR? 214.43.227.165.in-addr.arpa. (45)
E..Ix...@.....+.C.C....5.5X..............214.43.227.165.in-addr.arpa.....
05:41:33.224715 IP 67.207.67.3.domain > lamp-ubuntu-s-1vcpu-1gb-tor1-01.40842: 53971 NXDomain 0/1/0 (112)
E.......<.w	C.C...+..5...xe..............214.43.227.165.in-addr.arpa................7.ns1.digitalocean.com.
hostmaster..e.*...*0.....	:.....
05:41:33.225601 IP lamp-ubuntu-s-1vcpu-1gb-tor1-01.57280 > 67.207.67.3.domain: 17292+ [1au] PTR? 35.27.50.70.in-addr.arpa. (53)
E..Q ...@.....+.C.C....5.=X.C............35.27.50.70.in-addr.arpa.......)........
